{"dataset_id":"incheon-care-ops-synthetic-workers-v2","guardrail":"합성 운영업무이며 실제 주민·수급자·고립자·고독사 위험자 또는 미수혜자 추정치가 아니다.","scenario_reference_date":"2026-08-12","schema_version":"2.0.0","seed":20260812,"spatial_contract":{"current_admin_dong_count":162,"current_admin_reference_date":"2026-07-01","geometry_reference_date":"2025-06-30","geometry_zone_count":156,"note":"운서1·2동, 아라1·2동과 4개 출장소는 현재 경계가 아니라 공유하는 2025 공간구역 안에 합성 좌표를 생성한다."},"synthetic":true,"workers":[{"constraints":{"assigned_admin_dong_codes_20260701":["2812551000"],"available_time_window":{"end":"17:00","start":"13:00"},"max_daily_approved_visits":2,"stairs_allowed":true,"travel_modes":["walking","public_transit"]},"display_name":"연결단원 001","id":"SYN-W-2812551000-01","location":{"current_admin_dong_code_20260701":"2812551000","current_admin_dong_name_20260701":"신포동","current_district_name_20260701":"제물포구","geometry_resolution":"exact_2025_geometry_zone","geometry_zone_id":"vworld_sgis_20250630:23010530","latitude":37.4714645,"longitude":126.6198857,"mapping_method":"unique_normalized_name","spatial_basis":"synthetic_point_within_2025_geometry_zone"},"matching_profile":{"gender_for_preference_matching":"female"},"role":"neighbor_connector","synthetic":true,"workflow":{"availability_status":"available"}},{"constraints":{"assigned_admin_dong_codes_20260701":["2812552000"],"available_time_window":{"end":"17:00","start":"13:00"},"max_daily_approved_visits":2,"stairs_allowed":true,"travel_modes":["walking"]},"display_name":"연결단원 002","id":"SYN-W-2812552000-01","location":{"current_admin_dong_code_20260701":"2812552000","current_admin_dong_name_20260701":"연안동","current_district_name_20260701":"제물포구","geometry_resolution":"exact_2025_geometry_zone","geometry_zone_id":"vworld_sgis_20250630:23010520","latitude":37.4383498,"longitude":126.615267,"mapping_method":"unique_normalized_name","spatial_basis":"synthetic_point_within_2025_geometry_zone"},"matching_profile":{"gender_for_preference_matching":"female"},"role":"neighbor_connector","synthetic":true,"workflow":{"availability_status":"available"}},{"constraints":{"assigned_admin_dong_codes_20260701":["2812553000"],"available_time_window":{"end":"16:00","start":"10:00"},"max_daily_approved_visits":5,"stairs_allowed":true,"travel_modes":["walking","public_transit"]},"display_name":"연결단원 003","id":"SYN-W-2812553000-01","location":{"current_admin_dong_code_20260701":"2812553000","current_admin_dong_name_20260701":"신흥동","current_district_name_20260701":"제물포구","geometry_resolution":"exact_2025_geometry_zone","geometry_zone_id":"vworld_sgis_20250630:23010540","latitude":37.4324516,"longitude":126.614856,"mapping_method":"unique_normalized_name","spatial_basis":"synthetic_point_within_2025_geometry_zone"},"matching_profile":{"gender_for_preference_matching":"female"},"role":"neighbor_connector","synthetic":true,"workflow":{"availability_status":"available"}},{"constraints":{"assigned_admin_dong_codes_20260701":["2812554000"],"available_time_window":{"end":"13:00","start":"09:00"},"max_daily_approved_visits":5,"stairs_allowed":true,"travel_modes":["walking","public_transit"]},"display_name":"연결단원 004","id":"SYN-W-2812554000-01","location":{"current_admin_dong_code_20260701":"2812554000","current_admin_dong_name_20260701":"도원동","current_district_name_20260701":"제물포구","geometry_resolution":"exact_2025_geometry_zone","geometry_zone_id":"vworld_sgis_20250630:23010560","latitude":37.4648491,"longitude":126.6404651,"mapping_method":"unique_normalized_name","spatial_basis":"synthetic_point_within_2025_geometry_zone"},"matching_profile":{"gender_for_preference_matching":"not_specified"},"role":"neighbor_connector","synthetic":true,"workflow":{"availability_status":"available"}},{"constraints":{"assigned_admin_dong_codes_20260701":["2812555000"],"available_time_window":{"end":"16:00","start":"10:00"},"max_daily_approved_visits":4,"stairs_allowed":true,"travel_modes":["car","walking"]},"display_name":"연결단원 005","id":"SYN-W-2812555000-01","location":{"current_admin_dong_code_20260701":"2812555000","current_admin_dong_name_20260701":"율목동","current_district_name_20260701":"제물포구","geometry_resolution":"exact_2025_geometry_zone","geometry_zone_id":"vworld_sgis_20250630:23010570","latitude":37.4707664,"longitude":126.6341694,"mapping_method":"unique_normalized_name","spatial_basis":"synthetic_point_within_2025_geometry_zone"},"matching_profile":{"gender_for_preference_matching":"male"},"role":"neighbor_connector","synthetic":true,"workflow":{"availability_status":"available"}},{"constraints":{"assigned_admin_dong_codes_20260701":["2812556000"],"available_time_window":{"end":"17:00","start":"13:00"},"max_daily_approved_visits":2,"stairs_allowed":true,"travel_modes":["walking"]},"display_name":"연결단원 006","id":"SYN-W-2812556000-01","location":{"current_admin_dong_code_20260701":"2812556000","current_admin_dong_name_20260701":"동인천동","current_district_name_20260701":"제물포구","geometry_resolution":"exact_2025_geometry_zone","geometry_zone_id":"vworld_sgis_20250630:23010580","latitude":37.4791439,"longitude":126.6274627,"mapping_method":"unique_normalized_name","spatial_basis":"synthetic_point_within_2025_geometry_zone"},"matching_profile":{"gender_for_preference_matching":"not_specified"},"role":"neighbor_connector","synthetic":true,"workflow":{"availability_status":"available"}},{"constraints":{"assigned_admin_dong_codes_20260701":["2812557000"],"available_time_window":{"end":"16:00","start":"10:00"},"max_daily_approved_visits":5,"stairs_allowed":true,"travel_modes":["car","walking"]},"display_name":"연결단원 007","id":"SYN-W-2812557000-01","location":{"current_admin_dong_code_20260701":"2812557000","current_admin_dong_name_20260701":"개항동","current_district_name_20260701":"제물포구","geometry_resolution":"exact_2025_geometry_zone","geometry_zone_id":"vworld_sgis_20250630:23010670","latitude":37.4772506,"longitude":126.6191641,"mapping_method":"unique_normalized_name","spatial_basis":"synthetic_point_within_2025_geometry_zone"},"matching_profile":{"gender_for_preference_matching":"female"},"role":"neighbor_connector","synthetic":true,"workflow":{"availability_status":"available"}},{"constraints":{"assigned_admin_dong_codes_20260701":["2812558000"],"available_time_window":{"end":"16:00","start":"10:00"},"max_daily_approved_visits":3,"stairs_allowed":true,"travel_modes":["walking","public_transit"]},"display_name":"연결단원 008","id":"SYN-W-2812558000-01","location":{"current_admin_dong_code_20260701":"2812558000","current_admin_dong_name_20260701":"만석동","current_district_name_20260701":"제물포구","geometry_resolution":"exact_2025_geometry_zone","geometry_zone_id":"vworld_sgis_20250630:23020510","latitude":37.485902,"longitude":126.6216363,"mapping_method":"unique_normalized_name","spatial_basis":"synthetic_point_within_2025_geometry_zone"},"matching_profile":{"gender_for_preference_matching":"male"},"role":"neighbor_connector","synthetic":true,"workflow":{"availability_status":"available"}},{"constraints":{"assigned_admin_dong_codes_20260701":["2812559000"],"available_time_window":{"end":"17:00","start":"13:00"},"max_daily_approved_visits":5,"stairs_allowed":false,"travel_modes":["walking","public_transit"]},"display_name":"연결단원 009","id":"SYN-W-2812559000-01","location":{"current_admin_dong_code_20260701":"2812559000","current_admin_dong_name_20260701":"화수1.화평동","current_district_name_20260701":"제물포구","geometry_resolution":"exact_2025_geometry_zone","geometry_zone_id":"vworld_sgis_20250630:23020520","latitude":37.478433,"longitude":126.6289619,"mapping_method":"unique_normalized_name","spatial_basis":"synthetic_point_within_2025_geometry_zone"},"matching_profile":{"gender_for_preference_matching":"male"},"role":"neighbor_connector","synthetic":true,"workflow":{"availability_status":"available"}},{"constraints":{"assigned_admin_dong_codes_20260701":["2812560000"],"available_time_window":{"end":"17:00","start":"13:00"},"max_daily_approved_visits":3,"stairs_allowed":true,"travel_modes":["walking"]},"display_name":"연결단원 010","id":"SYN-W-2812560000-01","location":{"current_admin_dong_code_20260701":"2812560000","current_admin_dong_name_20260701":"화수2동","current_district_name_20260701":"제물포구","geometry_resolution":"exact_2025_geometry_zone","geometry_zone_id":"vworld_sgis_20250630:23020530","latitude":37.4845858,"longitude":126.6320029,"mapping_method":"unique_normalized_name","spatial_basis":"synthetic_point_within_2025_geometry_zone"},"matching_profile":{"gender_for_preference_matching":"not_specified"},"role":"neighbor_connector","synthetic":true,"workflow":{"availability_status":"available"}},{"constraints":{"assigned_admin_dong_codes_20260701":["2812561000"],"available_time_window":{"end":"13:00","start":"09:00"},"max_daily_approved_visits":4,"stairs_allowed":true,"travel_modes":["walking","public_transit"]},"display_name":"연결단원 011","id":"SYN-W-2812561000-01","location":{"current_admin_dong_code_20260701":"2812561000","current_admin_dong_name_20260701":"송현1.2동","current_district_name_20260701":"제물포구","geometry_resolution":"exact_2025_geometry_zone","geometry_zone_id":"vworld_sgis_20250630:23020550","latitude":37.4767827,"longitude":126.635464,"mapping_method":"unique_normalized_name","spatial_basis":"synthetic_point_within_2025_geometry_zone"},"matching_profile":{"gender_for_preference_matching":"female"},"role":"neighbor_connector","synthetic":true,"workflow":{"availability_status":"available"}},{"constraints":{"assigned_admin_dong_codes_20260701":["2812562000"],"available_time_window":{"end":"13:00","start":"09:00"},"max_daily_approved_visits":3,"stairs_allowed":true,"travel_modes":["car","walking"]},"display_name":"연결단원 012","id":"SYN-W-2812562000-01","location":{"current_admin_dong_code_20260701":"2812562000","current_admin_dong_name_20260701":"송현3동","current_district_name_20260701":"제물포구","geometry_resolution":"exact_2025_geometry_zone","geometry_zone_id":"vworld_sgis_20250630:23020570","latitude":37.4910002,"longitude":126.6434308,"mapping_method":"un